{
  "decision_id": "dec-cb0001-0000",
  "contract_version": 2,
  "strategy_id": "chess.single_agent_tree",
  "strategy_version": "0.1.0",
  "model_ref": "muse-spark-1.3-contributor",
  "seed": 7,
  "tool_registry": [
    "board_observe",
    "board_inspect",
    "board_expand",
    "board_compare",
    "memory_recall",
    "analysis_record"
  ],
  "max_rounds": 8,
  "max_protocol_errors": 3,
  "feature_flags": [],
  "content_sha256": "0b6872fdd48a14b6ae5b041bb9e15b810c87441f97ac715058a5752308bdfca4"
}